v_products_model,v_products_type,v_products_image,v_products_name_1,v_products_description_1,v_products_url_1,v_specials_price,v_specials_date_avail,v_specials_expires_date,v_products_price,v_master_categories_id,v_products_id,v_products_weight,v_product_is_call,v_products_sort_order,v_products_quantity_order_min,v_products_quantity_order_units,v_products_priced_by_attribute,v_product_is_always_free_shipping,v_date_avail,v_date_added,v_products_quantity,v_manufacturers_name,v_categories_name_1,v_tax_class_title,v_status,v_metatags_products_name_status,v_metatags_title_status,v_metatags_model_status,v_metatags_price_status,v_metatags_title_tagline_status,v_metatags_title_1,v_metatags_keywords_1,v_metatags_description_1
"","1","","Chef Salad","Ham, turkey, tomato, cucumber, broccoli, mushrooms, hard boil egg and shredded cheddar.","","","","","9.95","17486","41706","0","0","0","1","1","0","0","","2017-09-04 04:30:51","0","","Locations^North Dakota^Grand Forks^Joe Black's^Menu^Salads","Taxable Goods","1","0","0","0","0","0","","",""
"","1","","Oriental Chicken Salad","Grilled chicken, mandrain oranges, crispy Chinese noodles, Asian ginger dressing, with sliced almonds. ","","","","","9.95","17486","41707","0","0","0","1","1","0","0","","2017-09-04 04:30:51","0","","Locations^North Dakota^Grand Forks^Joe Black's^Menu^Salads","Taxable Goods","1","0","0","0","0","0","","",""
"","1","","Build Your Own Lahvosh","","","","","","11.45","17487","41709","0","0","0","1","1","0","0","","2017-09-04 04:30:51","0","","Locations^North Dakota^Grand Forks^Joe Black's^Menu^Lahvosh","Taxable Goods","1","0","0","0","0","0","","",""
"","1","","Veggie Lahvosh","Onions, tomatoes, green peppers, mushrooms, black olives and Havarti cheese.","","","","","14.95","17487","41712","0","0","0","1","1","0","0","","2017-09-04 04:30:51","0","","Locations^North Dakota^Grand Forks^Joe Black's^Menu^Lahvosh","Taxable Goods","1","0","0","0","0","0","","",""
"","1","","Lavish Lahvosh","Pepperoni, Italian sausage, green peppers, black olives, onions, mushrooms and Havarti cheese.","","","","","15.95","17487","41717","0","0","0","1","1","0","0","","2017-09-04 04:30:51","0","","Locations^North Dakota^Grand Forks^Joe Black's^Menu^Lahvosh","Taxable Goods","1","0","0","0","0","0","","",""
"","1","","Taco Lahvosh","Seasoned beef,onions, tomatoes, black olives, lettuce, cheddar, Havarti cheese and tortilla chips. ","","","","","15.95","17487","41718","0","0","0","1","1","0","0","","2017-09-04 04:30:51","0","","Locations^North Dakota^Grand Forks^Joe Black's^Menu^Lahvosh","Taxable Goods","1","0","0","0","0","0","","",""
"","1","","Buffalo Chicken Lahvosh","Buffalo chicken, green peppers, onions, Havarti cheese and ranch dressing.","","","","","15.95","17487","41719","0","0","0","1","1","0","0","","2017-09-04 04:30:51","0","","Locations^North Dakota^Grand Forks^Joe Black's^Menu^Lahvosh","Taxable Goods","1","0","0","0","0","0","","",""
"","1","","Chicken Philly Lahvosh","Diced chicken with onions, green peppers, mushrooms and Havarti cheese, topped with chipotle sauce.","","","","","16.95","17487","41722","0","0","0","1","1","0","0","","2017-09-04 04:30:51","0","","Locations^North Dakota^Grand Forks^Joe Black's^Menu^Lahvosh","Taxable Goods","1","0","0","0","0","0","","",""
"","1","","Build Your Own Pizza","","","","","","12.45","17488","41710","0","0","0","1","1","0","0","","2017-09-04 04:30:51","0","","Locations^North Dakota^Grand Forks^Joe Black's^Menu^Pizza","Taxable Goods","1","0","0","0","0","0","","",""
"","1","","Joe Black's Best Pizza","Pepperoni, Italian sausage, green peppers, black olives, onions mushrooms. ","","","","","15.95","17488","41713","0","0","0","1","1","0","0","","2017-09-04 04:30:51","0","","Locations^North Dakota^Grand Forks^Joe Black's^Menu^Pizza","Taxable Goods","1","0","0","0","0","0","","",""
"","1","","Four Meat Pizza","Pepperoni, beef, Italian sausage and Canadian bacon.","","","","","15.95","17488","41714","0","0","0","1","1","0","0","","2017-09-04 04:30:51","0","","Locations^North Dakota^Grand Forks^Joe Black's^Menu^Pizza","Taxable Goods","1","0","0","0","0","0","","",""
"","1","","Hawaiian Pizza","Canadian bacon and pineapple.","","","","","15.95","17488","41715","0","0","0","1","1","0","0","","2017-09-04 04:30:51","0","","Locations^North Dakota^Grand Forks^Joe Black's^Menu^Pizza","Taxable Goods","1","0","0","0","0","0","","",""
"","1","","Buffalo Chicken Pizza","Buffalo chicken, green peppers, onions and ranch dressing. ","","","","","15.95","17488","41716","0","0","0","1","1","0","0","","2017-09-04 04:30:51","0","","Locations^North Dakota^Grand Forks^Joe Black's^Menu^Pizza","Taxable Goods","1","0","0","0","0","0","","",""
"","1","","Taco Pizza","Seasoned ground beef, onions, tomatoes, black olives, lettuce, cheddar cheese and tortilla chips. ","","","","","16.95","17488","41720","0","0","0","1","1","0","0","","2017-09-04 04:30:51","0","","Locations^North Dakota^Grand Forks^Joe Black's^Menu^Pizza","Taxable Goods","1","0","0","0","0","0","","",""
"","1","","Ragin Cajun Pizza","Chicken, sausage, shrimp, bell pepper, red onion and garlic. ","","","","","16.95","17488","41721","0","0","0","1","1","0","0","","2017-09-04 04:30:51","0","","Locations^North Dakota^Grand Forks^Joe Black's^Menu^Pizza","Taxable Goods","1","0","0","0","0","0","","",""
"","1","","Mac & Cheese","Spiral Noodles and Cheese Sauce","","","","","0","17807","42703","0","0","0","1","1","1","0","","2017-10-14 02:11:49","0","","Locations^North Dakota^Grand Forks^Up North Pizza^Menu^Loaded Mac & Cheese","Taxable Goods","1","0","0","0","0","0","","",""
"","1","","Jalapeno Pesto Bacon Mac & Cheese","Jalapeno Pesto & Bacon Jam","","","","","0","17807","42704","0","0","0","1","1","1","0","","2017-10-14 02:12:20","0","","Locations^North Dakota^Grand Forks^Up North Pizza^Menu^Loaded Mac & Cheese","Taxable Goods","1","0","0","0","0","0","","",""
"","1","","Buffalo Chicken Mac & Cheese","Buffalo Sauce, Chicken, Gorgonzola Crumbles, topped with Tomatoes & Celery","","","","","0","17807","42705","0","0","0","1","1","1","0","","2017-10-14 02:13:39","0","","Locations^North Dakota^Grand Forks^Up North Pizza^Menu^Loaded Mac & Cheese","Taxable Goods","1","0","0","0","0","0","","",""
"","1","","Szechuan Mac & Cheese","Garlic chicken, pepper blend and Szechuan sauce.","","","","","0","17807","42706","0","0","0","1","1","1","0","","2017-10-14 02:14:17","0","","Locations^North Dakota^Grand Forks^Up North Pizza^Menu^Loaded Mac & Cheese","Taxable Goods","1","0","0","0","0","0","","",""
"BEVERAGE","1","","2 Liter","","","","","","3.59","10529","13058","0","0","0","1","1","0","0","","0000-00-00 00:00:00","0","","Locations^North Dakota^Grand Forks^Crooked Pint^Menu^Beverages","Taxable Goods","1","0","0","0","0","0","","",""
"BEVERAGE","1","","Bottled Water - 16.9 oz","","","","","","1.29","10529","13567","0","0","0","1","1","0","0","","0000-00-00 00:00:00","0","","Locations^North Dakota^Grand Forks^Crooked Pint^Menu^Beverages","Taxable Goods","1","0","0","0","0","0","","",""
"BEVERAGE","1","","20 oz","","","","","","2.79","10529","14076","0","0","0","1","1","0","0","","0000-00-00 00:00:00","0","","Locations^North Dakota^Grand Forks^Crooked Pint^Menu^Beverages","Taxable Goods","1","0","0","0","0","0","","",""
"RESTAURANTMISC","1","","Restaurant Charge","","","","","","1","10528","12228","0","0","0","0.01","0.01","0","0","","0000-00-00 00:00:00","0","","Locations^North Dakota^Grand Forks^Crooked Pint^Menu^Restaurant Misc","Taxable Goods","1","0","0","0","0","0","","",""
"FOODDUDEMISC","1","","Food Dudes Charge","","","","","","1","10527","12549","0","0","0","0.01","0.01","0","0","","0000-00-00 00:00:00","0","","Locations^North Dakota^Grand Forks^Crooked Pint^Menu^Food Dudes Misc","Taxable Goods","1","0","0","0","0","0","","",""
"BEVERAGE","1","","2 Liter","","","","","","3.59","10529","13058","0","0","0","1","1","0","0","","0000-00-00 00:00:00","0","","Locations^North Dakota^Grand Forks^Smiling Moose^Menu^Beverages","Taxable Goods","1","0","0","0","0","0","","",""
"BEVERAGE","1","","Bottled Water - 16.9 oz","","","","","","1.29","10529","13567","0","0","0","1","1","0","0","","0000-00-00 00:00:00","0","","Locations^North Dakota^Grand Forks^Smiling Moose^Menu^Beverages","Taxable Goods","1","0","0","0","0","0","","",""
"BEVERAGE","1","","20 oz","","","","","","2.79","10529","14076","0","0","0","1","1","0","0","","0000-00-00 00:00:00","0","","Locations^North Dakota^Grand Forks^Smiling Moose^Menu^Beverages","Taxable Goods","1","0","0","0","0","0","","",""
"RESTAURANTMISC","1","","Restaurant Charge","","","","","","1","10528","12228","0","0","0","0.01","0.01","0","0","","0000-00-00 00:00:00","0","","Locations^North Dakota^Grand Forks^Smiling Moose^Menu^Restaurant Misc","Taxable Goods","1","0","0","0","0","0","","",""
"FOODDUDEMISC","1","","Food Dudes Charge","","","","","","1","10527","12549","0","0","0","0.01","0.01","0","0","","0000-00-00 00:00:00","0","","Locations^North Dakota^Grand Forks^Smiling Moose^Menu^Food Dudes Misc","Taxable Goods","1","0","0","0","0","0","","",""
"","1","","Morning Moose","Scrambled eggs and cheddar with choice of bacon, sausage or ham on a bagel, baguette or wrap","","","","","6","1295","3737","0","0","0","1","1","0","0","","2015-04-27 01:30:00","0","","Locations^North Dakota^Grand Forks^Smiling Moose^Menu^Breakfast All Day","Taxable Goods","1","0","0","0","0","0","","",""
"","1","","Mountain Sunrise","Sausage, scrambled eggs, spinach, roasted red pepper and pepper jack on a bagel baguette or wrap","","","","","6.5","1295","3738","0","0","0","1","1","0","0","","2015-04-27 01:30:00","0","","Locations^North Dakota^Grand Forks^Smiling Moose^Menu^Breakfast All Day","Taxable Goods","1","0","0","0","0","0","","",""
"","1","","Wake & Bake Waffles","Two pearl sugar-crusted Belgian waffles with maple syrup","","","","","6","1295","3739","0","0","0","1","1","0","0","","2015-04-27 01:30:00","0","","Locations^North Dakota^Grand Forks^Smiling Moose^Menu^Breakfast All Day","Taxable Goods","1","0","0","0","0","0","","",""
"","1","","Mo! Rito","Chopped sirloin, scrambled eggs, American potatoes, salsa fresca, cream cheese.","","","","","6.5","1295","3740","0","0","0","1","1","0","0","","2015-04-27 01:30:00","0","","Locations^North Dakota^Grand Forks^Smiling Moose^Menu^Breakfast All Day","Taxable Goods","1","0","0","0","0","0","","",""
"","1","","Basecamp Skillet","Sausage, scrambled eggs, potatoes, cheddar, tomatoes, crimini mushrooms, spinach","","","","","6.5","1295","17480","0","0","5","1","1","0","0","","2015-12-14 00:59:54","0","","Locations^North Dakota^Grand Forks^Smiling Moose^Menu^Breakfast All Day","Taxable Goods","1","0","0","0","0","0","","",""
"","1","","The Motherlode","Grilled turkey, roast beef, ham, bacon, Swiss, cheddar, romaine, tomatoes, banana peppers, mayo","","","","","0","1297","3763","0","0","0","1","1","1","0","","2015-04-27 01:30:00","0","","Locations^North Dakota^Grand Forks^Smiling Moose^Menu^Sandwiches & Wraps","Taxable Goods","1","0","0","0","0","0","","",""
"","1","","Alpine Dip","Grilled roast beef, horseradish aioli and Swiss served with au jus","","","","","0","1297","3764","0","0","0","1","1","1","0","","2015-04-27 01:30:00","0","","Locations^North Dakota^Grand Forks^Smiling Moose^Menu^Sandwiches & Wraps","Taxable Goods","1","0","0","0","0","0","","",""
"","1","","Pesto Peak Italiano","Grilled salami, capicola, pepperoni, ham, provolone, romaine, red onions, tomatoes, banana peppers, lemon pesto aioli","","","","","0","1297","3765","0","0","0","1","1","1","0","","2015-04-27 01:30:00","0","","Locations^North Dakota^Grand Forks^Smiling Moose^Menu^Sandwiches & Wraps","Taxable Goods","1","0","0","0","0","0","","",""
"","1","","Dude Ranch","Grilled turkey, bacon, cheddar, avocado mash, romaine, tomatoes, ranch","","","","","0","1297","3766","0","0","0","1","1","1","0","","2015-04-27 01:30:00","0","","Locations^North Dakota^Grand Forks^Smiling Moose^Menu^Sandwiches & Wraps","Taxable Goods","1","0","0","0","0","0","","",""
"","1","","Mountain Club","Grilled turkey, bacon, Swiss, romaine, tomatoes, red onions, lemon pesto aioli","","","","","0","1297","3767","0","0","0","1","1","1","0","","2015-04-27 01:30:00","0","","Locations^North Dakota^Grand Forks^Smiling Moose^Menu^Sandwiches & Wraps","Taxable Goods","1","0","0","0","0","0","","",""
"","1","","Orchard Chicken","Blend of apples, pecans, diced chicken, celery, mayo and Dijon, with spinach","","","","","0","1297","3768","0","0","0","1","1","1","0","","2015-04-27 01:30:00","0","","Locations^North Dakota^Grand Forks^Smiling Moose^Menu^Sandwiches & Wraps","Taxable Goods","1","0","0","0","0","0","","",""
"","1","","Green Thumb","Sauteed spinach, roasted red peppers, artichoke hearts, tomatoes, crimini mushrooms, Swiss, lemon pesto aioli","","","","","0","1297","3769","0","0","0","1","1","1","0","","2015-04-27 01:30:00","0","","Locations^North Dakota^Grand Forks^Smiling Moose^Menu^Sandwiches & Wraps","Taxable Goods","1","0","0","0","0","0","","",""
"","1","","Lemon Pepper Tuna","Lemon pepper tuna, arugula, cucumbers, tomatoes, red onions, lemon pesto aioli","","","","","0","1297","3770","0","0","0","1","1","1","0","","2015-04-27 01:30:00","0","","Locations^North Dakota^Grand Forks^Smiling Moose^Menu^Sandwiches & Wraps","Taxable Goods","1","0","0","0","0","0","","",""
"","1","","Hippie Chick P.","Roasted red pepper hummus, cheddar, avocado mash, arugula, tomatoes, cucumbers, red onions, cilanto","","","","","0","1297","3771","0","0","0","1","1","1","0","","2015-04-27 01:30:00","0","","Locations^North Dakota^Grand Forks^Smiling Moose^Menu^Sandwiches & Wraps","Taxable Goods","1","0","0","0","0","0","","",""
"","1","","Wildfire Chicken","Grilled chicken, provolone, avocado mash, tomatoes, sriracha lime aioli","","","","","0","1297","3772","0","0","0","1","1","1","0","","2015-04-27 01:30:00","0","","Locations^North Dakota^Grand Forks^Smiling Moose^Menu^Sandwiches & Wraps","Taxable Goods","1","0","0","0","0","0","","",""
"","1","","Ridgeline Pastrami","Grilled pastrami, Swiss, sauerkraut and 1000 Island on marble rye","","","","","0","1297","3773","0","0","0","1","1","1","0","","2015-04-27 01:30:00","0","","Locations^North Dakota^Grand Forks^Smiling Moose^Menu^Sandwiches & Wraps","Taxable Goods","1","0","0","0","0","0","","",""
"","1","","Mile-Hi Thai","Grilled chicken, cabbage, roasted red peppers, cilantro, spicy Thai peanut sauce","","","","","0","1297","56676","0","0","0","1","1","1","0","","2018-08-01 10:39:03","0","","Locations^North Dakota^Grand Forks^Smiling Moose^Menu^Sandwiches & Wraps","Taxable Goods","1","0","0","0","0","0","","",""
"","1","","Wild Turkey","Oven roasted turkey, bacon, Swiss, avocado mash, spinach, tomatoes, cranberry chipotle aioli","","","","","0","1297","56677","0","0","0","1","1","1","0","","2018-08-01 10:46:18","0","","Locations^North Dakota^Grand Forks^Smiling Moose^Menu^Sandwiches & Wraps","Taxable Goods","1","0","0","0","0","0","","",""
"","1","","BBQ Bacon Mo!","Ground beef with melted American cheese and bacon, topped with BBQ sauce, chopped romaine, crispy onion straws, and mayo","","","","","0","1299","3759","0","0","0","1","1","1","0","","2015-04-27 01:30:00","0","","Locations^North Dakota^Grand Forks^Smiling Moose^Menu^The Mo!","Taxable Goods","1","0","0","0","0","0","","",""
"","1","","Southwest Mo!","Ground beef with melted American cheese, avocado mash and chipotle mayo, topped with chopped romaine, housemade salsa fresca, and candied Jalapeños.","","","","","0","1299","3760","0","0","0","1","1","1","0","","2015-04-27 01:30:00","0","","Locations^North Dakota^Grand Forks^Smiling Moose^Menu^The Mo!","Taxable Goods","1","0","0","0","0","0","","",""
"","1","","The Original  Mo!","Ground beef with melted American cheese, topped with chopped romaine, tomatoes, red onions, banana peppers, mayo, oil & vinegar, and salt & pepper","","","","","0","1299","3761","0","0","0","1","1","1","0","","2015-04-27 01:30:00","0","","Locations^North Dakota^Grand Forks^Smiling Moose^Menu^The Mo!","Taxable Goods","1","0","0","0","0","0","","",""
"","1","","Kick'N Nashville Chick'N Mo!","Chopped Red Bird Farms chicken with melted aged cheddar and our spicy, Smoked Nashville Sauce cooled off with Sweet candied jalapenos and mayo.","","","","","0","1299","50681","0","0","0","1","1","1","0","","2018-04-23 16:57:01","0","","Locations^North Dakota^Grand Forks^Smiling Moose^Menu^The Mo!","Taxable Goods","1","0","0","0","0","0","","",""
"","1","","Bacon Blackened Bleu Mo!","Blackened chopped sirloin with melted aged cheddar, layered with hardwood-smoked bacon and bleu cheese crumbles topped with chopped romaine, diced tomatoes, mayo, and salt & pepper.","","","","","0","1299","50682","0","0","0","1","1","1","0","","2018-04-23 16:58:44","0","","Locations^North Dakota^Grand Forks^Smiling Moose^Menu^The Mo!","Taxable Goods","1","0","0","0","0","0","","",""
"","1","","Steakhouse Mo!","Chopped sirloin with melted aged cheddar, mixed with grilled mushrooms and onions, melted Swiss, A.1. Original Steak sauce, and our own peppercorn aioli.","","","","","0","1299","50683","0","0","0","1","1","1","0","","2018-04-23 16:59:57","0","","Locations^North Dakota^Grand Forks^Smiling Moose^Menu^The Mo!","Taxable Goods","1","0","0","0","0","0","","",""
"","1","","Bronx Pastrami Mo!","Chopped sirloin with melted aged cheddar, premium grilled pastrami, sauteed onions, Grey Poupon Dijon Mustard and roasted garlic aioli all topped with melted Swiss, and even MORE pastrami.","","","","","0","1299","50684","0","0","0","1","1","1","0","","2018-04-23 17:01:27","0","","Locations^North Dakota^Grand Forks^Smiling Moose^Menu^The Mo!","Taxable Goods","1","0","0","0","0","0","","",""
"","1","","Cream of Tomato Basil","","","","","","0","1301","3755","0","0","0","1","1","1","0","","2015-04-27 01:30:00","0","","Locations^North Dakota^Grand Forks^Smiling Moose^Menu^Soups","Taxable Goods","1","0","0","0","0","0","","",""
"","1","","Homestyle Chicken Noodle","","","","","","0","1301","3757","0","0","0","1","1","1","0","","2015-04-27 01:30:00","0","","Locations^North Dakota^Grand Forks^Smiling Moose^Menu^Soups","Taxable Goods","1","0","0","0","0","0","","",""
"","1","","Spicy Chicken Enchilada","","","","","","0","1301","3758","0","0","0","1","1","1","0","","2015-04-27 01:30:00","0","","Locations^North Dakota^Grand Forks^Smiling Moose^Menu^Soups","Taxable Goods","1","0","0","0","0","0","","",""
"","1","","Crunchy Asian","Grilled chicken, romaine, cabbage, carrots, red onions, roasted red peppers, chow mein noodles, Asian Sesame dressing.","","","","","9.25","1302","3779","0","0","0","1","1","0","0","","2015-04-27 01:30:00","0","","Locations^North Dakota^Grand Forks^Smiling Moose^Menu^Salads","Taxable Goods","1","0","0","0","0","0","","",""
"","1","","Beef & Bleu Salad","Grilled roast beef, mixed greens, bleu cheese, onion straws, bacon, tomatoes, roasted red peppers, balsamic dressing.","","","","","9.5","1302","3780","0","0","0","1","1","0","0","","2015-04-27 01:30:00","0","","Locations^North Dakota^Grand Forks^Smiling Moose^Menu^Salads","Taxable Goods","1","0","0","0","0","0","","",""
"","1","","Country Cobb","Grilled chicken, romaine, bacon, cheddar, bleu cheese, hard-boiled eggs, tomatoes, cucumbers, avocado, ranch dressing","","","","","9.25","1302","3781","0","0","0","1","1","0","0","","2015-04-27 01:30:00","0","","Locations^North Dakota^Grand Forks^Smiling Moose^Menu^Salads","Taxable Goods","1","0","0","0","0","0","","",""
"","1","","Sweet Harvest","Grilled chicken, dried cranberries, candied pecans, red onions, mixed green, orange rosemary dressing.","","","","","9.25","1302","3782","0","0","0","1","1","0","0","","2015-04-27 01:30:00","0","","Locations^North Dakota^Grand Forks^Smiling Moose^Menu^Salads","Taxable Goods","1","0","0","0","0","0","","",""
"","1","","Creekside Greek","Grilled chicken, romaine, Kalamata olives, tomatoes, cucumbers, feta, red onions, Greek dressing.","","","","","9.25","1302","3783","0","0","0","1","1","0","0","","2015-04-27 01:30:00","0","","Locations^North Dakota^Grand Forks^Smiling Moose^Menu^Salads","Taxable Goods","1","0","0","0","0","0","","",""
"","1","","Kale Caesar","Grilled chicken, kale, romaine, shaved Parmesan, croutons, Caesar dressing.","","","","","9.5","1302","56675","0","0","0","1","1","0","0","","2018-08-01 10:13:48","0","","Locations^North Dakota^Grand Forks^Smiling Moose^Menu^Salads","Taxable Goods","1","0","0","0","0","0","","",""
"BEVERAGE","1","","2 Liter","","","","","","3.59","10529","13058","0","0","0","1","1","0","0","","0000-00-00 00:00:00","0","","Locations^North Dakota^Grand Forks^Scotty's Deli^Menu^Beverages","Taxable Goods","1","0","0","0","0","0","","",""
"BEVERAGE","1","","Bottled Water - 16.9 oz","","","","","","1.29","10529","13567","0","0","0","1","1","0","0","","0000-00-00 00:00:00","0","","Locations^North Dakota^Grand Forks^Scotty's Deli^Menu^Beverages","Taxable Goods","1","0","0","0","0","0","","",""
"BEVERAGE","1","","20 oz","","","","","","2.79","10529","14076","0","0","0","1","1","0","0","","0000-00-00 00:00:00","0","","Locations^North Dakota^Grand Forks^Scotty's Deli^Menu^Beverages","Taxable Goods","1","0","0","0","0","0","","",""
"RESTAURANTMISC","1","","Restaurant Charge","","","","","","1","10528","12228","0","0","0","0.01","0.01","0","0","","0000-00-00 00:00:00","0","","Locations^North Dakota^Grand Forks^Scotty's Deli^Menu^Restaurant Misc","Taxable Goods","1","0","0","0","0","0","","",""
"FOODDUDEMISC","1","","Food Dudes Charge","","","","","","1","10527","12549","0","0","0","0.01","0.01","0","0","","0000-00-00 00:00:00","0","","Locations^North Dakota^Grand Forks^Scotty's Deli^Menu^Food Dudes Misc","Taxable Goods","1","0","0","0","0","0","","",""
"","1","","Regular Tips","11oz or 22oz of our famous beef tips in our special homemade au jus sauce. Served with garlic toast and hard rolls.","","","","","0","19480","50959","0","0","0","1","1","1","0","","2018-04-26 01:45:48","0","","Locations^North Dakota^Grand Forks^Scotty's Deli^Menu^Starters","Taxable Goods","1","0","0","0","0","0","","",""
"","1","","Deluxe Tips","11oz or 22oz of our famous beef tips with mushrooms,green & red peppers, and onions in our special homemade au jus sauce. Served with garlic toast and hard rolls. ","","","","","0","19480","50960","0","0","0","1","1","1","0","","2018-04-26 01:45:48","0","","Locations^North Dakota^Grand Forks^Scotty's Deli^Menu^Starters","Taxable Goods","1","0","0","0","0","0","","",""
"","1","","French Fries","Small or large, regular or Cajun","","","","","0","19480","50961","0","0","0","1","1","1","0","","2018-04-26 01:45:48","0","","Locations^North Dakota^Grand Forks^Scotty's Deli^Menu^Starters","Taxable Goods","1","0","0","0","0","0","","",""
"","1","","Sweet Potato Fries","Small or large. Served with spicy ranch","","","","","0","19480","50962","0","0","0","1","1","1","0","","2018-04-26 01:45:48","0","","Locations^North Dakota^Grand Forks^Scotty's Deli^Menu^Starters","Taxable Goods","1","0","0","0","0","0","","",""
"","1","","Spinach Queso & Chips","Small or large. Pepper jack cheese & spinach with a delightful bite and served with tortilla chips","","","","","0","19480","50963","0","0","0","1","1","1","0","","2018-04-26 01:45:48","0","","Locations^North Dakota^Grand Forks^Scotty's Deli^Menu^Starters","Taxable Goods","1","0","0","0","0","0","","",""
"","1","","Onion Rings","Small or large. Hand breaded onion rings. Served with homemade OR sauce","","","","","0","19480","50964","0","0","0","1","1","1","0","","2018-04-26 01:45:48","0","","Locations^North Dakota^Grand Forks^Scotty's Deli^Menu^Starters","Taxable Goods","1","0","0","0","0","0","","",""
"","1","","Chili Cheese Fries","French fries covered in homemade chili and topped with shredded cheese.","","","","","6.5","19480","51005","0","0","0","1","1","0","0","","2018-04-26 01:45:48","0","","Locations^North Dakota^Grand Forks^Scotty's Deli^Menu^Starters","Taxable Goods","1","0","0","0","0","0","","",""
"","1","","Cheese Lavosh","10"" or 16""","","","","","0","19481","50965","0","0","0","1","1","1","0","","2018-04-26 01:45:48","0","","Locations^North Dakota^Grand Forks^Scotty's Deli^Menu^Lavosh","Taxable Goods","1","0","0","0","0","0","","",""
"","1","","Veggie Lavosh","10"" or 16"" Green & red peppers, onions, mushrooms and tomatoes. Served with spicy ranch","","","","","0","19481","50966","0","0","0","1","1","1","0","","2018-04-26 01:45:48","0","","Locations^North Dakota^Grand Forks^Scotty's Deli^Menu^Lavosh","Taxable Goods","1","0","0","0","0","0","","",""
"","1","","Canadian Bacon Lavosh","10"" or 16"". Comes with green & red peppers and onions. Served with spicy ranch","","","","","0","19481","50967","0","0","0","1","1","1","0","","2018-04-26 01:45:48","0","","Locations^North Dakota^Grand Forks^Scotty's Deli^Menu^Lavosh","Taxable Goods","1","0","0","0","0","0","","",""
"","1","","Pepperoni Lavosh","10"" or 16"". Comes with green & red peppers and onions. Served with spicy ranch","","","","","0","19481","50968","0","0","0","1","1","1","0","","2018-04-26 01:45:48","0","","Locations^North Dakota^Grand Forks^Scotty's Deli^Menu^Lavosh","Taxable Goods","1","0","0","0","0","0","","",""
"","1","","Italian Sausage Lavosh","10"" or 16"" Italian saudage with grilled green & red peppers, onions and banana peppers. Served with spicy ranch","","","","","0","19481","50969","0","0","0","1","1","1","0","","2018-04-26 01:45:48","0","","Locations^North Dakota^Grand Forks^Scotty's Deli^Menu^Lavosh","Taxable Goods","1","0","0","0","0","0","","",""
"","1","","Taco Lavosh","10"" or 16"" Choose beef or chicken. Comes with lettuce, tomatoes, cheese and chips. Served with hot sauce and sour cream. ","","","","","0","19481","50970","0","0","0","1","1","1","0","","2018-04-26 01:45:48","0","","Locations^North Dakota^Grand Forks^Scotty's Deli^Menu^Lavosh","Taxable Goods","1","0","0","0","0","0","","",""
