v_products_model,v_products_type,v_products_image,v_products_name_1,v_products_description_1,v_products_url_1,v_specials_price,v_specials_date_avail,v_specials_expires_date,v_products_price,v_master_categories_id,v_products_id,v_products_weight,v_product_is_call,v_products_sort_order,v_products_quantity_order_min,v_products_quantity_order_units,v_products_priced_by_attribute,v_product_is_always_free_shipping,v_date_avail,v_date_added,v_products_quantity,v_manufacturers_name,v_categories_name_1,v_tax_class_title,v_status,v_metatags_products_name_status,v_metatags_title_status,v_metatags_model_status,v_metatags_price_status,v_metatags_title_tagline_status,v_metatags_title_1,v_metatags_keywords_1,v_metatags_description_1
"","1","","Side of Raspberry Vinaigrette","","","","","","0.79","21892","58901","0","0","0","1","1","0","0","","2018-09-03 12:46:58","0","","Locations^North Dakota^Minot^Ground Round^Dinner Menu^Sauces","Taxable Goods","1","0","0","0","0","0","","",""
"","1","","Side of Caesar","","","","","","0.79","21892","58902","0","0","0","1","1","0","0","","2018-09-03 12:47:20","0","","Locations^North Dakota^Minot^Ground Round^Dinner Menu^Sauces","Taxable Goods","1","0","0","0","0","0","","",""
"","1","","Side of Honey Mustard","","","","","","0.79","21892","58903","0","0","0","1","1","0","0","","2018-09-03 12:47:39","0","","Locations^North Dakota^Minot^Ground Round^Dinner Menu^Sauces","Taxable Goods","1","0","0","0","0","0","","",""
"","1","","Side of Sweet Italian","","","","","","0.79","21892","58904","0","0","0","1","1","0","0","","2018-09-03 12:48:06","0","","Locations^North Dakota^Minot^Ground Round^Dinner Menu^Sauces","Taxable Goods","1","0","0","0","0","0","","",""
"","1","","Side of Italian","","","","","","0.79","21892","58905","0","0","0","1","1","0","0","","2018-09-03 12:48:25","0","","Locations^North Dakota^Minot^Ground Round^Dinner Menu^Sauces","Taxable Goods","1","0","0","0","0","0","","",""
"","1","","Side of French","","","","","","0.79","21892","58906","0","0","0","1","1","0","0","","2018-09-03 12:48:40","0","","Locations^North Dakota^Minot^Ground Round^Dinner Menu^Sauces","Taxable Goods","1","0","0","0","0","0","","",""
"","1","","Side of 1000 Island","","","","","","0.79","21892","58907","0","0","0","1","1","0","0","","2018-09-03 12:49:00","0","","Locations^North Dakota^Minot^Ground Round^Dinner Menu^Sauces","Taxable Goods","1","0","0","0","0","0","","",""
"","1","","Smoked Chicken Wings","Seasoned, house smoked, and then grilled. Get them bathed in our signature bone's BBQ sauce or served naked. Simply delicious, get them in your hands now.","","","","","0","21907","58978","0","0","0","1","1","1","0","","2018-09-05 02:28:26","0","","Locations^North Dakota^Minot^Bones BBQ^Menu^Bones Starters","Taxable Goods","1","0","0","0","0","0","","",""
"","1","","Okra","A big taste of the south all wrapped up the little bites of golden fried deliciousness.","","","","","7.99","21907","58993","0","0","0","1","1","0","0","","2018-09-05 02:28:26","0","","Locations^North Dakota^Minot^Bones BBQ^Menu^Bones Starters","Taxable Goods","1","0","0","0","0","0","","",""
"","1","","Mac & Cheese Bites","A generous helping of mac & cheese, deep fried golden brown and served with a side of ranch. It's ooey gooey good!","","","","","7.99","21907","58994","0","0","0","1","1","0","0","","2018-09-05 02:28:26","0","","Locations^North Dakota^Minot^Bones BBQ^Menu^Bones Starters","Taxable Goods","1","0","0","0","0","0","","",""
"","1","","Basket of Rings","Grab the gang; crispy golden fried onion rings served with ranch dressing.","","","","","8.49","21907","58995","0","0","0","1","1","0","0","","2018-09-05 02:28:26","0","","Locations^North Dakota^Minot^Bones BBQ^Menu^Bones Starters","Taxable Goods","1","0","0","0","0","0","","",""
"","1","","Fried Pickles","Zesty dill pickle chips fried golden brown. Served with bistro sauce. Lips meet zip!","","","","","9.49","21907","58997","0","0","0","1","1","0","0","","2018-09-05 02:28:26","0","","Locations^North Dakota^Minot^Bones BBQ^Menu^Bones Starters","Taxable Goods","1","0","0","0","0","0","","",""
"","1","","Loin Back Ribs","These baby backs are the superstars of the smoker. Seasoned, hand rubbed, and slow smoked with hickory wood for 4 plus hours. Brushed with a lite glaze of our signature bone's BBQ sauce. Show these to your mouth!. Come with a choice of two sides and a cornbread muffin.","","","","","0","21908","58979","0","0","0","1","1","1","0","","2018-09-05 02:28:26","0","","Locations^North Dakota^Minot^Bones BBQ^Menu^Bones Slow Smoked BBQ","Taxable Goods","1","0","0","0","0","0","","",""
"","1","","Pulled Pork","This pile of premium pork packs a punch. It's seasoned, hand rubbed and slow smoked with hickory wood for 9 plus hours. Pow! Come with a choice of two sides and a cornbread muffin.","","","","","13.99","21908","59012","0","0","0","1","1","0","0","","2018-09-05 02:28:26","0","","Locations^North Dakota^Minot^Bones BBQ^Menu^Bones Slow Smoked BBQ","Taxable Goods","1","0","0","0","0","0","","",""
"","1","","Texas Style Beef Brisket","Catch this brisket while you can. It's hand trimmed, seasoned and slow smoked over hickory wood for 12 plus hours. Get this fast moving favorite while supplies last. Come with a choice of two sides and a cornbread muffin.","","","","","15.99","21908","59014","0","0","0","1","1","0","0","","2018-09-05 02:28:26","0","","Locations^North Dakota^Minot^Bones BBQ^Menu^Bones Slow Smoked BBQ","Taxable Goods","1","0","0","0","0","0","","",""
"","1","","Bone's Smoked Chicken","This bird has a wild side. Premium whole chickens seasoned, hand rubbed and house smoked for 2 plus hours, then brushed with a lite glaze of our signature bone?s BBQ sauce and grilled.","","","","","0","21909","58980","0","0","0","1","1","1","0","","2018-09-05 02:28:26","0","","Locations^North Dakota^Minot^Bones BBQ^Menu^Bones Chicken, Seafood N More","Taxable Goods","1","0","0","0","0","0","","",""
"","1","","Bones Fish N Chips","A fish fry to inspire legends. Newcastle Brown Beer battered, golden fried wild caught Alaskan Cod Fillets, natural cut kettle chips, coleslaw, and tarter sauce. Served with a corn bread muffin, honey and butter.","","","","","14.75","21909","66885","0","0","0","1","1","0","0","","2019-02-13 15:27:35","0","","Locations^North Dakota^Minot^Bones BBQ^Menu^Bones Chicken, Seafood N More","Taxable Goods","1","0","0","0","0","0","","",""
"","1","","BBQ Pulled Pork Spud","Pulled pork, bacon, cheddar, onion tanglers, sour cream and Bone's BBQ sauce all atop a toasty baked potato.","","","","","9.99","21909","66886","0","0","0","1","1","0","0","","2019-02-13 15:44:09","0","","Locations^North Dakota^Minot^Bones BBQ^Menu^Bones Chicken, Seafood N More","Taxable Goods","1","0","0","0","0","0","","",""
"","1","","House Made Soup","","","","","","0","21910","58981","0","0","0","1","1","1","0","","2018-09-05 02:28:26","0","","Locations^North Dakota^Minot^Bones BBQ^Menu^Bones Salads 'N Soups","Taxable Goods","1","0","0","0","0","0","","",""
"","1","","House Made Chili","","","","","","0","21910","58982","0","0","0","1","1","1","0","","2018-09-05 02:28:26","0","","Locations^North Dakota^Minot^Bones BBQ^Menu^Bones Salads 'N Soups","Taxable Goods","1","0","0","0","0","0","","",""
"","1","","Side Salad","Garden or Caesar.","","","","","4.99","21910","58987","0","0","0","1","1","0","0","","2018-09-05 02:28:26","0","","Locations^North Dakota^Minot^Bones BBQ^Menu^Bones Salads 'N Soups","Taxable Goods","1","0","0","0","0","0","","",""
"","1","","Caesar Salad","We put together a mean Caesar with crisp romaine, parmesan cheese, croutons, and Caesar dressing. Hail to the great Caesar!","","","","","9.99","21910","58998","0","0","0","1","1","0","0","","2018-09-05 02:28:26","0","","Locations^North Dakota^Minot^Bones BBQ^Menu^Bones Salads 'N Soups","Taxable Goods","1","0","0","0","0","0","","",""
"","1","","Soup & Salad","A classic hot & cold combo. Your choice of a cup of house made soup or chili with a side salad ? garden or Caesar. All together it?s just right!","","","","","8.99","21910","58999","0","0","0","1","1","0","0","","2018-09-05 02:28:26","0","","Locations^North Dakota^Minot^Bones BBQ^Menu^Bones Salads 'N Soups","Taxable Goods","1","0","0","0","0","0","","",""
"","1","","House Garden Salad","Enjoy fresh flavors of salad greens, diced tomatoes, cucumbers, cheddar-jack cheese, and croutons. It?s all the garden without the gardening!","","","","","9.99","21910","59000","0","0","0","1","1","0","0","","2018-09-05 02:28:26","0","","Locations^North Dakota^Minot^Bones BBQ^Menu^Bones Salads 'N Soups","Taxable Goods","1","0","0","0","0","0","","",""
"","1","","Grilled Chicken Salad","Our housed seasoned grilled chicken goes perfectly with fresh salad greens, diced tomatoes, cucumbers, peppered bacon, cheddar-jack cheese, and croutons. It?s a great way to add protein to all of those!","","","","","11.99","21910","59004","0","0","0","1","1","0","0","","2018-09-05 02:28:26","0","","Locations^North Dakota^Minot^Bones BBQ^Menu^Bones Salads 'N Soups","Taxable Goods","1","0","0","0","0","0","","",""
"","1","","Chef Salad","Add more meat to your veggies. Housed smoked turkey, house cured smoked ham, peppered bacon, fresh salad greens, diced tomatoes, cucumbers, cheddar-jack cheese, and croutons. Served just the way our chef likes it!","","","","","13.99","21910","59005","0","0","0","1","1","0","0","","2018-09-05 02:28:26","0","","Locations^North Dakota^Minot^Bones BBQ^Menu^Bones Salads 'N Soups","Taxable Goods","1","0","0","0","0","0","","",""
"","1","","Southern Peach Cobbler","Homemade and fresh baked just like grandma used to make. Satisfies any appetite!","","","","","4.25","21911","58985","0","0","0","1","1","0","0","","2018-09-05 02:28:26","0","","Locations^North Dakota^Minot^Bones BBQ^Menu^Homemade Desserts","Taxable Goods","1","0","0","0","0","0","","",""
"","1","","Bone's Bread Pudding","Scratch made bread pudding and rum sauce served warm. Mmmmm.","","","","","4.5","21911","58986","0","0","0","1","1","0","0","","2018-09-05 02:28:26","0","","Locations^North Dakota^Minot^Bones BBQ^Menu^Homemade Desserts","Taxable Goods","1","0","0","0","0","0","","",""
"","1","","Kids Grilled Cheese","Loved so much it gets fan mail. For kids 10 and under. Includes one side choice.","","","","","5.99","21912","58988","0","0","0","1","1","0","0","","2018-09-05 02:28:26","0","","Locations^North Dakota^Minot^Bones BBQ^Menu^Kids Menu","Taxable Goods","1","0","0","0","0","0","","",""
"","1","","Kids Rib Plate","For kids 10 and under. Includes one side choice.","","","","","6.99","21912","58989","0","0","0","1","1","0","0","","2018-09-05 02:28:26","0","","Locations^North Dakota^Minot^Bones BBQ^Menu^Kids Menu","Taxable Goods","1","0","0","0","0","0","","",""
"","1","","Kids Chicken Tenders","For kids 10 and under. Includes one side choice.","","","","","5.99","21912","58990","0","0","0","1","1","0","0","","2018-09-05 02:28:26","0","","Locations^North Dakota^Minot^Bones BBQ^Menu^Kids Menu","Taxable Goods","1","0","0","0","0","0","","",""
"","1","","Kids Grilled Hotdog","For kids 10 and under. Includes one side choice.","","","","","5.99","21912","58991","0","0","0","1","1","0","0","","2018-09-05 02:28:26","0","","Locations^North Dakota^Minot^Bones BBQ^Menu^Kids Menu","Taxable Goods","1","0","0","0","0","0","","",""
"","1","","Kids Pulled Pork Sammy","For kids 10 and under. Includes one side choice.","","","","","5.99","21912","58992","0","0","0","1","1","0","0","","2018-09-05 02:28:26","0","","Locations^North Dakota^Minot^Bones BBQ^Menu^Kids Menu","Taxable Goods","1","0","0","0","0","0","","",""
"","1","","Jayden Hamburger","","","","","","6.99","21912","66887","0","0","0","1","1","0","0","","2019-02-13 15:52:37","0","","Locations^North Dakota^Minot^Bones BBQ^Menu^Kids Menu","Taxable Goods","1","0","0","0","0","0","","",""
"","1","","Grilled Cheese Sandwich","Come with one side choice.","","","","","8.49","21913","58996","0","0","0","1","1","0","0","","2018-09-05 02:28:26","0","","Locations^North Dakota^Minot^Bones BBQ^Menu^Bones Sandwiches","Taxable Goods","1","0","0","0","0","0","","",""
"","1","","Pulled Pork Sammy","This pork has real pull. Seasoned, house smoked and pulled. Piled high on a fresh baked Kaiser roll. Come with one side choice.","","","","","10.99","21913","59002","0","0","0","1","1","0","0","","2018-09-05 02:28:26","0","","Locations^North Dakota^Minot^Bones BBQ^Menu^Bones Sandwiches","Taxable Goods","1","0","0","0","0","0","","",""
"","1","","Smoked Brisket Sandwich","Piled high with hand seasoned, slow smoked Texas style brisket. Served on a fresh baked Kaiser roll. Come with one side choice.","","","","","12.99","21913","59003","0","0","0","1","1","0","0","","2018-09-05 02:28:26","0","","Locations^North Dakota^Minot^Bones BBQ^Menu^Bones Sandwiches","Taxable Goods","1","0","0","0","0","0","","",""
"","1","","Smokey Pepper Jack Turkey Sandwich","We take our smoked turkey to the next level. House smoked turkey breast, peppered bacon, pepper-jack cheese, Chipotle Mayo served on fresh baked grilled sourdough bread. It's a taste you wont soon forget! Come with one side choice.","","","","","12.99","21913","59007","0","0","0","1","1","0","0","","2018-09-05 02:28:26","0","","Locations^North Dakota^Minot^Bones BBQ^Menu^Bones Sandwiches","Taxable Goods","1","0","0","0","0","0","","",""
"","1","","Smoked Sausage Sandwich","This Philly style sandwich is the father of flavor. House smoked sausage, red & green bell peppers, onions, pepper-jack cheese, bone?s BBQ sauce. Served on a fresh baked hoagie roll. Taste the love! Come with one side choice.","","","","","11.99","21913","59008","0","0","0","1","1","0","0","","2018-09-05 02:28:26","0","","Locations^North Dakota^Minot^Bones BBQ^Menu^Bones Sandwiches","Taxable Goods","1","0","0","0","0","0","","",""
"","1","","The Cuban Sandwich","This steamy grill pressed sandwich is revolutionary. House smoked pulled pork and ham, Swiss cheese, pickles, and house mustard. Served on a fresh baked hoagie roll. Simply delicious! Come with one side choice.","","","","","11.99","21913","59009","0","0","0","1","1","0","0","","2018-09-05 02:28:26","0","","Locations^North Dakota^Minot^Bones BBQ^Menu^Bones Sandwiches","Taxable Goods","1","0","0","0","0","0","","",""
"","1","","Bone's Flying Saucer Style Pizza Burger","Bone's original flying saucer style sandwich. Fresh house ground beef chuck, pepper jack cheese and pizza sauce. Sealed between two slices of our house-baked sourdough bread. Come with one side choice.","","","","","11.99","21913","59010","0","0","0","1","1","0","0","","2018-09-05 02:28:26","0","","Locations^North Dakota^Minot^Bones BBQ^Menu^Bones Sandwiches","Taxable Goods","1","0","0","0","0","0","","",""
"","1","","Smokehouse Chicken Sandwich","Seasoned, grilled chicken breast with peppered bacon, pepper-jack cheese and our Bone's Original BBQ sauce. Served on a fresh, baked Kaiser Roll.","","","","","13.99","21913","66884","0","0","0","1","1","0","0","","2019-02-13 15:20:33","0","","Locations^North Dakota^Minot^Bones BBQ^Menu^Bones Sandwiches","Taxable Goods","1","0","0","0","0","0","","",""
"","1","","The Bare Burger","For those times when less is more. 1/2 lb. burger, seasoned just right, and grilled to perfection. Served on a fresh baked toasted Kaiser roll. Ground fresh in-house and come with lettuce, tomato, pickles, red onion and one side choice.","","","","","10.99","21914","59001","0","0","0","1","1","0","0","","2018-09-05 02:28:26","0","","Locations^North Dakota^Minot^Bones BBQ^Menu^Bones Burgers","Taxable Goods","1","0","0","0","0","0","","",""
"","1","","Bone's Spicy Black Bean BBQ Burger","We take our house made black bean burger, add roasted red peppers, pepper-jack cheese, top it off with our signature bone's BBQ sauce and serve it up on a fresh baked toasted Kaiser roll. Beanilicious! Ground fresh in-house and come with lettuce, tomato, pickles, red onion and one side choice.","","","","","11.99","21914","59006","0","0","0","1","1","0","0","","2018-09-05 02:28:26","0","","Locations^North Dakota^Minot^Bones BBQ^Menu^Bones Burgers","Taxable Goods","1","0","0","0","0","0","","",""
"","1","","BBQ Bacon Burger","This burger is a bona fide 1/2 lb. burger. Cheddar cheese, peppered bacon, and our signature bone's BBQ sauce. Served on a fresh baked toasted Kaiser roll. Bring it! Ground fresh in-house and come with lettuce, tomato, pickles, red onion and one side choice.","","","","","12.99","21914","59011","0","0","0","1","1","0","0","","2018-09-05 02:28:26","0","","Locations^North Dakota^Minot^Bones BBQ^Menu^Bones Burgers","Taxable Goods","1","0","0","0","0","0","","",""
"","1","","Bone's Smokehouse Burger","A real BBQ bad boy. We start with a 1/2 lb. burger, pepper jack cheese, peppered bacon, a pile of house smoked pulled pork, and top it off with our signature bone's BBQ sauce and serve it up smoking hot on a fresh baked toasted Kaiser roll. Boom! Ground fresh in-house and come with lettuce, tomato, pickles, red onion and one side choice.","","","","","13.99","21914","59013","0","0","0","1","1","0","0","","2018-09-05 02:28:26","0","","Locations^North Dakota^Minot^Bones BBQ^Menu^Bones Burgers","Taxable Goods","1","0","0","0","0","0","","",""
"","1","","Any Two Meats","Come with two sides and a dinner roll.(Choose different Meats, We don't do the same Meats)","","","","","17.99","21915","59015","0","0","0","1","1","0","0","","2018-09-05 02:28:26","0","","Locations^North Dakota^Minot^Bones BBQ^Menu^Create Your Own Bone's Favorite","Taxable Goods","1","0","0","0","0","0","","",""
"","1","","One Favorite & 1/3 Rack of Ribs","Come with two sides and a dinner roll.","","","","","19.99","21915","59016","0","0","0","1","1","0","0","","2018-09-05 02:28:26","0","","Locations^North Dakota^Minot^Bones BBQ^Menu^Create Your Own Bone's Favorite","Taxable Goods","1","0","0","0","0","0","","",""
"","1","","Any Three Meats","Come with two sides and a dinner roll.(Choose different Meats, We don't do the same Meats)","","","","","22.99","21915","59017","0","0","0","1","1","0","0","","2018-09-05 02:28:26","0","","Locations^North Dakota^Minot^Bones BBQ^Menu^Create Your Own Bone's Favorite","Taxable Goods","1","0","0","0","0","0","","",""
"","1","","Pho","Vietnamese noodle: rice stick noodle, beef meatball, bean sprouts, cilantro, jalapeno, onion, lime. Noodles lose quality quickly, so this item is best to order pre-heated only if you do not have a microwave to heat yourself for immediate consumption.","","","","","8.99","22266","59829","0","0","0","1","1","0","0","","2018-09-17 21:02:44","0","","Locations^North Dakota^Minot^Grand Junction^Menu^Vietnamese Dishes","Taxable Goods","1","0","0","0","0","0","","",""
"","1","","Vietnamese Sandwich","","","","","","0","22266","60998","0","0","0","1","1","1","0","","2018-10-11 21:49:51","0","","Locations^North Dakota^Minot^Grand Junction^Menu^Vietnamese Dishes","Taxable Goods","1","0","0","0","0","0","","",""
"BEVERAGE","1","","2 Liter","","","","","","3.59","18247","44635","0","0","0","1","1","0","0","","2017-12-13 06:37:45","0","","Locations^North Dakota^Minot^Qdoba (2045 N Broadway)^Menu^Beverages","Taxable Goods","1","0","0","0","0","0","","",""
"BEVERAGE","1","","20 oz","","","","","","2.79","18247","44636","0","0","0","1","1","0","0","","2017-12-13 06:38:11","0","","Locations^North Dakota^Minot^Qdoba (2045 N Broadway)^Menu^Beverages","Taxable Goods","1","0","0","0","0","0","","",""
"BEVERAGE","1","","Bottled Water - 16.9 oz","","","","","","1.29","18247","44637","0","0","0","1","1","0","0","","2017-12-13 06:38:34","0","","Locations^North Dakota^Minot^Qdoba (2045 N Broadway)^Menu^Beverages","Taxable Goods","1","0","0","0","0","0","","",""
"RESTAURANTMISC","1","","Restaurant Charge","","","","","","1","18248","44638","0","0","0","0.01","0.01","0","0","0001-01-01 00:00:00","2017-12-13 06:39:38","0","","Locations^North Dakota^Minot^Qdoba (2045 N Broadway)^Menu^Restaurant Misc","Taxable Goods","1","0","0","0","0","0","","",""
"FOODDUDEMISC","1","","Food Dudes Charge","","","","","","1","18249","44639","0","0","0","0.01","0.01","0","0","0001-01-01 00:00:00","2017-12-13 06:40:03","0","","Locations^North Dakota^Minot^Qdoba (2045 N Broadway)^Menu^Food Dudes Misc","Taxable Goods","1","0","0","0","0","0","","",""
"BEVERAGE","1","","2 Liter","","","","","","3.59","18247","44635","0","0","0","1","1","0","0","","2017-12-13 06:37:45","0","","Locations^North Dakota^Minot^Qdoba (1700 South Broadway)^Menu^Beverages","Taxable Goods","1","0","0","0","0","0","","",""
"BEVERAGE","1","","20 oz","","","","","","2.79","18247","44636","0","0","0","1","1","0","0","","2017-12-13 06:38:11","0","","Locations^North Dakota^Minot^Qdoba (1700 South Broadway)^Menu^Beverages","Taxable Goods","1","0","0","0","0","0","","",""
"BEVERAGE","1","","Bottled Water - 16.9 oz","","","","","","1.29","18247","44637","0","0","0","1","1","0","0","","2017-12-13 06:38:34","0","","Locations^North Dakota^Minot^Qdoba (1700 South Broadway)^Menu^Beverages","Taxable Goods","1","0","0","0","0","0","","",""
"RESTAURANTMISC","1","","Restaurant Charge","","","","","","1","18248","44638","0","0","0","0.01","0.01","0","0","0001-01-01 00:00:00","2017-12-13 06:39:38","0","","Locations^North Dakota^Minot^Qdoba (1700 South Broadway)^Menu^Restaurant Misc","Taxable Goods","1","0","0","0","0","0","","",""
"FOODDUDEMISC","1","","Food Dudes Charge","","","","","","1","18249","44639","0","0","0","0.01","0.01","0","0","0001-01-01 00:00:00","2017-12-13 06:40:03","0","","Locations^North Dakota^Minot^Qdoba (1700 South Broadway)^Menu^Food Dudes Misc","Taxable Goods","1","0","0","0","0","0","","",""
"","1","","Potato Salad","","","","","","2.25","22705","61397","0","0","0","1","1","0","0","","2018-10-24 13:15:17","0","","Locations^North Dakota^Minot^Bones BBQ^Menu^Sides","Taxable Goods","1","0","0","0","0","0","","",""
"","1","","Baked Sweet Potato","","","","","","3.25","22705","61398","0","0","0","1","1","0","0","","2018-10-24 13:15:32","0","","Locations^North Dakota^Minot^Bones BBQ^Menu^Sides","Taxable Goods","1","0","0","0","0","0","","",""
"","1","","Coleslaw","","","","","","2.25","22705","61399","0","0","0","1","1","0","0","","2018-10-24 13:15:46","0","","Locations^North Dakota^Minot^Bones BBQ^Menu^Sides","Taxable Goods","1","0","0","0","0","0","","",""
"","1","","Natural Cut Fries","","","","","","2.25","22705","61400","0","0","0","1","1","0","0","","2018-10-24 13:16:01","0","","Locations^North Dakota^Minot^Bones BBQ^Menu^Sides","Taxable Goods","1","0","0","0","0","0","","",""
"","1","","BBQ Baked Beans","","","","","","2.25","22705","61401","0","0","0","1","1","0","0","","2018-10-24 13:16:14","0","","Locations^North Dakota^Minot^Bones BBQ^Menu^Sides","Taxable Goods","1","0","0","0","0","0","","",""
"","1","","Mac & Cheese","","","","","","2.25","22705","61403","0","0","0","1","1","0","0","","2018-10-24 13:16:41","0","","Locations^North Dakota^Minot^Bones BBQ^Menu^Sides","Taxable Goods","1","0","0","0","0","0","","",""
"","1","","House Made Kettle Chips","","","","","","2.25","22705","61404","0","0","0","1","1","0","0","","2018-10-24 13:16:57","0","","Locations^North Dakota^Minot^Bones BBQ^Menu^Sides","Taxable Goods","1","0","0","0","0","0","","",""
"","1","","Onion Rings","","","","","","3.25","22705","61405","0","0","0","1","1","0","0","","2018-10-24 13:17:13","0","","Locations^North Dakota^Minot^Bones BBQ^Menu^Sides","Taxable Goods","1","0","0","0","0","0","","",""
"","1","","Sweet Potato Fries","","","","","","3.25","22705","61406","0","0","0","1","1","0","0","","2018-10-24 13:17:28","0","","Locations^North Dakota^Minot^Bones BBQ^Menu^Sides","Taxable Goods","1","0","0","0","0","0","","",""
"","1","","Corn Bread Muffin","","","","","","0","22705","61407","0","0","0","1","1","1","0","","2018-10-24 13:17:42","0","","Locations^North Dakota^Minot^Bones BBQ^Menu^Sides","Taxable Goods","1","0","0","0","0","0","","",""
"","1","","Burrito","Choice of protein.","","","","","8.84","22779","61695","0","0","0","1","1","0","0","","2018-10-29 20:14:07","0","","Locations^North Dakota^Minot^Qdoba (1700 South Broadway)^Menu^Create Your Own","Taxable Goods","1","0","0","0","0","0","","",""
"","1","","Burrito Bowl","Choice of protein.","","","","","8.84","22779","61696","0","0","0","1","1","0","0","","2018-10-29 20:14:07","0","","Locations^North Dakota^Minot^Qdoba (1700 South Broadway)^Menu^Create Your Own","Taxable Goods","1","0","0","0","0","0","","",""
"","1","","Grilled Quesadilla","Choice of protein.","","","","","8.84","22779","61697","0","0","0","1","1","0","0","","2018-10-29 20:14:07","0","","Locations^North Dakota^Minot^Qdoba (1700 South Broadway)^Menu^Create Your Own","Taxable Goods","1","0","0","0","0","0","","",""
"","1","","3-Cheese Nachos","Choice of protein.","","","","","8.84","22779","61698","0","0","0","1","1","0","0","","2018-10-29 20:14:07","0","","Locations^North Dakota^Minot^Qdoba (1700 South Broadway)^Menu^Create Your Own","Taxable Goods","1","0","0","0","0","0","","",""
"","1","","Taco Salad (Bowl)","Choice of protein.","","","","","8.84","22779","61699","0","0","0","1","1","0","0","","2018-10-29 20:14:07","0","","Locations^North Dakota^Minot^Qdoba (1700 South Broadway)^Menu^Create Your Own","Taxable Goods","1","0","0","0","0","0","","",""
"","1","","Taco Salad (Shell)","Choice of protein.","","","","","8.84","22779","61700","0","0","0","1","1","0","0","","2018-10-29 20:14:07","0","","Locations^North Dakota^Minot^Qdoba (1700 South Broadway)^Menu^Create Your Own","Taxable Goods","1","0","0","0","0","0","","",""
"","1","","Loaded Tortilla Soup","Choice of protein.","","","","","8.84","22779","61701","0","0","0","1","1","0","0","","2018-10-29 20:14:07","0","","Locations^North Dakota^Minot^Qdoba (1700 South Broadway)^Menu^Create Your Own","Taxable Goods","1","0","0","0","0","0","","",""
