v_products_model,v_products_type,v_products_image,v_products_name_1,v_products_description_1,v_products_url_1,v_specials_price,v_specials_date_avail,v_specials_expires_date,v_products_price,v_master_categories_id,v_products_id,v_products_weight,v_product_is_call,v_products_sort_order,v_products_quantity_order_min,v_products_quantity_order_units,v_products_priced_by_attribute,v_product_is_always_free_shipping,v_date_avail,v_date_added,v_products_quantity,v_manufacturers_name,v_categories_name_1,v_tax_class_title,v_status,v_metatags_products_name_status,v_metatags_title_status,v_metatags_model_status,v_metatags_price_status,v_metatags_title_tagline_status,v_metatags_title_1,v_metatags_keywords_1,v_metatags_description_1
"","1","","Seafood Burrito Grande","You'll love this grande burrito!  A large flour tortilla stuffed with our flavorful seafood filling, topped with seafood sauce and melted mozzarella cheese.","","","","","13.99","1188","3703","0","0","0","1","1","0","0","0000-00-00 00:00:00","2015-04-27 01:30:00","0","","Locations^North Dakota^Minot^Paradiso/Minot^Menu^Seafood","Taxable Goods","1","0","0","0","0","0","","",""
"","1","","Acapulco Seafood Salad","A delightful blend of seafood served over a bed of fresh lettuce, decorated with generous amounts of tomatoes, mild Cheddar and Monterey Jack cheese and black olives.","","","","","11.99","12671","20608","0","0","0","1","1","0","0","","2016-04-27 22:28:26","0","","Locations^North Dakota^Minot^Paradiso/Minot^Menu^Seafood","Taxable Goods","1","0","0","0","0","0","","",""
"","1","","Cancun Combo","Two seafood enchiladas stuffed with flavorful seafood filling and covered with our special seafood sauce and creamy mozzarella cheese. Served with Spanish rice.","","","","","13.99","12671","20609","0","0","0","1","1","0","0","","2016-04-27 22:30:55","0","","Locations^North Dakota^Minot^Paradiso/Minot^Menu^Seafood","Taxable Goods","1","0","0","0","0","0","","",""
"","1","","Wild caught fish or cod tacos","A savory duo of our grilled, wild-caught Alaskan salmon or lightly breaded cod served with mango pico de gallo and freshly chopped cilantro. Served with baja sauce, sour cream topping, lime wedge and a side of Spanish rice and fresh, seasoned and grilled vegetable mix.","","","","","11.99","12671","20610","0","0","0","1","1","0","0","","2016-04-27 22:32:36","0","","Locations^North Dakota^Minot^Paradiso/Minot^Menu^Seafood","Taxable Goods","1","0","0","0","0","0","","",""
"","1","","Seafood Enchilada Grande","We don't skimp on this enchilada! Our chef's special seafood filling, covered in a creamy seafood sauce and sprinkled with mozzarella cheese, stuffed in a large flour tortilla. Served with Spanish rice and your choice of beans.","","","","","13.99","12671","20611","0","0","0","1","1","0","0","","2016-04-27 22:34:09","0","","Locations^North Dakota^Minot^Paradiso/Minot^Menu^Seafood","Taxable Goods","1","0","0","0","0","0","","",""
"","1","","Wild-Alaskan Glazed Salmon","Try our new wild-Alaskan salmon glazed with our house-made jalapeno jelly sauce. Served with grilled tomatoes, fresh mango pico de gallo and our seasoned and grilled vegetable mix.","","","","","13.99","12671","20612","0","0","0","1","1","0","0","","2016-04-27 22:35:55","0","","Locations^North Dakota^Minot^Paradiso/Minot^Menu^Seafood","Taxable Goods","1","0","0","0","0","0","","",""
"","1","","Super Seafood Taco","A soft fresh tortilla and stuffed with our flavorful seafood filling, covered with our special seafood sauce, creamy Mozzarella cheese, fresh lettuce and diced tomatoes.","","","","","7.99","12671","20613","0","0","0","1","1","0","0","","2016-04-27 22:37:30","0","","Locations^North Dakota^Minot^Paradiso/Minot^Menu^Seafood","Taxable Goods","1","0","0","0","0","0","","",""
"","1","","Enchilada Plate Dinner","Your choice of four enchiladas: two hand-rolled enchiladas with your choice of meat paired with two of Paradiso’s famous Cheddar and Monterey Jack cheese enchiladas and topped with our homemade sauce.","","","","","14.99","1187","3684","0","0","0","1","1","0","0","0000-00-00 00:00:00","2015-04-27 01:30:00","0","","Locations^North Dakota^Minot^Paradiso/Minot^Menu^Enchiladas","Taxable Goods","1","0","0","0","0","0","","",""
"","1","","Magnificent Three","Bring your appetite! Choose from any three of our savory favorites, beef, chicken, pork carnitas or cheese enchiladas.  Add Spanish rice and your choice of beans for 1.49.","","","","","12.99","1187","3685","0","0","0","1","1","0","0","","2015-04-27 01:30:00","0","","Locations^North Dakota^Minot^Paradiso/Minot^Menu^Enchiladas","Taxable Goods","1","0","0","0","0","0","","",""
"","1","","Tremendous Two","For the smaller appetite, enjoy a savory pair of beef, chicken, pork carnitas or cheese enchiladas.  Add Spanish rice and refried beans or fresh, seasoned and grilled vegetable mix for 1.49.","","","","","10.49","1187","3686","0","0","0","1","1","0","0","","2015-04-27 01:30:00","0","","Locations^North Dakota^Minot^Paradiso/Minot^Menu^Enchiladas","Taxable Goods","1","0","0","0","0","0","","",""
"","1","","Incredible One","Your choice of beef, chicken, pork carnitas or cheese. Served with Spanish rice and your choice of beans. Substitute Spanish rice and beans with our fresh, seasoned and grilled vegetable mix for .99.","","","","","7.49","1187","3687","0","0","0","1","1","0","0","","2015-04-27 01:30:00","0","","Locations^North Dakota^Minot^Paradiso/Minot^Menu^Enchiladas","Taxable Goods","1","0","0","0","0","0","","",""
"","1","","Carnitas Burrito","Morsels of seasoned lean pork marinated with savory herbs, spices and onions. Braised until tender and stuffed into a flour tortilla and covered with chile verde and melted cheese. Served with sour cream topping.","","","","","12.99","1188","3701","0","0","0","1","1","0","0","","2015-04-27 01:30:00","0","","Locations^North Dakota^Minot^Paradiso/Minot^Menu^Burritos","Taxable Goods","1","0","0","0","0","0","","",""
"","1","","Paradiso Burrito","Muy Grande! It’s fully stuffed with your choice of meat, finished with our savory red sauce and melted Cheddar and Monterey Jack cheese. It's the best! ","","","","","12.99","1188","3702","0","0","0","1","1","0","0","0000-00-00 00:00:00","2015-04-27 01:30:00","0","","Locations^North Dakota^Minot^Paradiso/Minot^Menu^Burritos","Taxable Goods","1","0","0","0","0","0","","",""
"","1","","Burrito Con Queso","There's only one way to make our burritos better - smother them in our incredible zesty cheese sauce and serve them with Spanish rice and your choice of beans. Choose beef or chicken. Substitute Spanish rice and beans with our fresh, seasoned and grilled vegetable mix for .99.","","","","","14.99","1188","3704","0","0","0","1","1","0","0","","2015-04-27 01:30:00","0","","Locations^North Dakota^Minot^Paradiso/Minot^Menu^Burritos","Taxable Goods","1","0","0","0","0","0","","",""
"","1","","Fajita Burrito","Sizzling tender steak or chicken strips with grilled onions and fresh poblano peppers, stuffed into a large flour tortilla and lavished with red sauce and melted Cheddar and Monterey Jack cheese. Served with Spanish rice and sour cream topping. ","","","","","14.99","1188","3705","0","0","0","1","1","0","0","0000-00-00 00:00:00","2015-04-27 01:30:00","0","","Locations^North Dakota^Minot^Paradiso/Minot^Menu^Burritos","Taxable Goods","1","0","0","0","0","0","","",""
"","1","","Chicken Burrito Monterey","Try this excellent combination of flavors! Mildly seasoned shredded chicken, broccoli and mozzarella cheese rolled into a warm tortilla and topped with our red sauce and melted Cheddar and Monterey Jack cheese. Served with Spanish rice and a colorful blend of our fresh, seasoned and grilled vegetable mix.","","","","","12.99","1188","3706","0","0","0","1","1","0","0","0000-00-00 00:00:00","2015-04-27 01:30:00","0","","Locations^North Dakota^Minot^Paradiso/Minot^Menu^Burritos","Taxable Goods","1","0","0","0","0","0","","",""
"","1","","Beef and Bean Burrito","A large flour tortilla wrapped around seasoned ground beef and refried beans, smothered with our homemade red sauce and melted Cheddar and Monterey Jack cheese.","","","","","12.99","1188","3707","0","0","0","1","1","0","0","0000-00-00 00:00:00","2015-04-27 01:30:00","0","","Locations^North Dakota^Minot^Paradiso/Minot^Menu^Burritos","Taxable Goods","1","0","0","0","0","0","","",""
"","1","","The Super Burrito","We're famous for this grande burrito stuffed with your choice of meat, refried beans and Spanish rice. Topped with red sauce, melted Cheddar and Monterey Jack cheese and served with diced tomatoes, shredded lettuce and sour cream topping.","","","","","14.99","1188","3709","0","0","0","1","1","0","0","0000-00-00 00:00:00","2015-04-27 01:30:00","0","","Locations^North Dakota^Minot^Paradiso/Minot^Menu^Burritos","Taxable Goods","1","0","0","0","0","0","","",""
"","1","","Burrito Poquito","For the smaller appetite. A mini burrito filled with your choice of meat and covered with savory red sauce, topped with Cheddar and Monterey Jack cheese. Served with a colorful blend of our fresh, seasoned and grilled vegetable mix, Spanish rice and your choice of beans.","","","","","10.49","1188","3710","0","0","0","1","1","0","0","","2015-04-27 01:30:00","0","","Locations^North Dakota^Minot^Paradiso/Minot^Menu^Burritos","Taxable Goods","1","0","0","0","0","0","","",""
"","1","","The Grilled Burrito","Try a lighter version of our classic burrito!  This made to order burrito offers the flavors and ingredients you love: shredded lettuce, black beans, pico de gallo, Spanish rice and you choice of meat, all folded into a  warm flour tortilla then grilled.  Served with a side of creamy chipolte ranch dressing.","","","","","10.99","1188","3725","0","0","0","1","1","0","0","","2015-04-27 01:30:00","0","","Locations^North Dakota^Minot^Paradiso/Minot^Menu^Burritos","Taxable Goods","1","0","0","0","0","0","","",""
"","1","","Jalapeno or Bean and Cheese Burrito","Your choice of a bean and cheese burrito or a bean and cheese burrito fired up with jalapeño peppers. Topped with mild Cheddar and Monterey Jack cheese and our homemade red sauce.","","","","","9.99","1188","21678","0","0","0","1","1","0","0","","2016-05-23 16:40:00","0","","Locations^North Dakota^Minot^Paradiso/Minot^Menu^Burritos","Taxable Goods","1","0","0","0","0","0","","",""
"","1","","Chicken Finger Dinner","Golden chicken breast tenderloins served with honey-mustard dipping sauce. Served with your choice of french fries or a chilled garden salad.","","","","","11.99","1189","3723","0","0","0","1","1","0","0","","2015-04-27 01:30:00","0","","Locations^North Dakota^Minot^Paradiso/Minot^Menu^Famous Favorites","Taxable Goods","1","0","0","0","0","0","","",""
"","1","","Soup & Salad","A piping hot bowl of our chicken tortilla soup served with a chilled side salad and breadstick.","","","","","7.99","1189","3724","0","0","0","1","1","0","0","0000-00-00 00:00:00","2015-04-27 01:30:00","0","","Locations^North Dakota^Minot^Paradiso/Minot^Menu^Famous Favorites","Taxable Goods","1","0","0","0","0","0","","",""
"","1","","Burger Platter","Our juicy burger char-broiled the way you like it, topped with Cheddar and Monterey Jack cheese. Garnished with Bermuda onion slices and pico de gallo. Served with your choice of french fries or a chilled garden salad.","","","","","10.99","1189","3726","0","0","0","1","1","0","0","","2015-04-27 01:30:00","0","","Locations^North Dakota^Minot^Paradiso/Minot^Menu^Famous Favorites","Taxable Goods","1","0","0","0","0","0","","",""
"","1","","Dos Tacos Platter","One of lifes simple pleasures. A pair of crispy six inch corn tortillas, seasoned ground beef and savory shredded chicken with mild Cheddar and Monterey Jack cheese and lettuce. Served with Spanish rice and beans.","","","","","7.49","1190","3712","0","0","0","1","1","0","0","","2015-04-27 01:30:00","0","","Locations^North Dakota^Minot^Paradiso/Minot^Menu^Tacos","Taxable Goods","1","0","0","0","0","0","","",""
"","1","","Soft Shell Taco Grande","A large flour tortilla stuffed with your choice of seasoned ground beef, shredded chicken or slow roasted carnitas.  Topped with Monterey Jack cheese, lettuce and sour cream topping. Served with a side of Spanish rice and your choice of beans. ","","","","","7.99","1190","3713","0","0","0","1","1","0","0","0000-00-00 00:00:00","2015-04-27 01:30:00","0","","Locations^North Dakota^Minot^Paradiso/Minot^Menu^Tacos","Taxable Goods","1","0","0","0","0","0","","",""
"","1","","Tacos Especial","Triple the taste with two large crunchy tacos and one soft taco filled with delicately seasoned ground beef, topped with mild Cheddar and Monterey Jack cheese. Served with Spanish rice and your choice of beans. Substitute Spanish rice and beans with our fresh, seasoned and grilled vegetable mix for .99.","","","","","12.99","1190","3715","0","0","0","1","1","0","0","","2015-04-27 01:30:00","0","","Locations^North Dakota^Minot^Paradiso/Minot^Menu^Tacos","Taxable Goods","1","0","0","0","0","0","","",""
"","1","","Baja Taco","Flavorful taqueria-style tacos. Two soft flour tortillas filled with grilled fajita steak or chicken, pico de gallo, freshly chopped cilantro, a blend of Monterey and Cheddar cheese and bacon on a bed of onions. Served with a side of Spanish rice, fresh, seasoned and grilled vegetable mix, sour cream topping and a lime wedge. Lightly sprinkled with Cotija cheese.","","","","","13.99","1190","3716","0","0","0","1","1","0","0","","2015-04-27 01:30:00","0","","Locations^North Dakota^Minot^Paradiso/Minot^Menu^Tacos","Taxable Goods","1","0","0","0","0","0","","",""
"","1","","Street Tacos","Straight from the heart of Mexico! Grilled mini corn tortillas topped with your choice of grilled meat and served with fresh mango pico de gallo, diced onions, guacamole and fresh cilantro. Lightly sprinkled with Cotija cheese.","","","","","12.99","1190","9250","0","0","0","1","1","0","0","","2015-04-27 01:30:00","0","","Locations^North Dakota^Minot^Paradiso/Minot^Menu^Tacos","Taxable Goods","1","0","0","0","0","0","","",""
"","1","","Fiesta Grill Combo","A fajita steak or marinated chicken breast hot off the flaming grill served with two cheese enchiladas smothered with our creamy white queso. A great trio!","","","","","15.99","1191","3718","0","0","0","1","1","0","0","0000-00-00 00:00:00","2015-04-27 01:30:00","0","","Locations^North Dakota^Minot^Paradiso/Minot^Menu^From the Grill","Taxable Goods","1","0","0","0","0","0","","",""
"","1","","Grilled Carne or Pollo Asada","One of our most popular dishes! Tender marinated steak or juicy chicken breast accompanied by your choice of two enchiladas (beef, chicken or cheese). Served with Spanish rice, pico de gallo, and warm flour tortillas. ","","","","","16.99","1191","3721","0","0","0","1","1","0","0","0000-00-00 00:00:00","2015-04-27 01:30:00","0","","Locations^North Dakota^Minot^Paradiso/Minot^Menu^From the Grill","Taxable Goods","1","0","0","0","0","0","","",""
"","1","","Grilled Chicken Breast","Choose between flavorful mesquite or barbecue and we’ll grill up a fresh chicken breast and serve it with Spanish rice or french fries and a chilled garden salad.","","","","","13.49","1191","3722","0","0","0","1","1","0","0","","2015-04-27 01:30:00","0","","Locations^North Dakota^Minot^Paradiso/Minot^Menu^From the Grill","Taxable Goods","1","0","0","0","0","0","","",""
"","1","","Fajita Wrap","Grilled fajita chicken or steak folded into a large warm tortilla with fresh mixed greens, pico de gallo, and shredded creamy mozzarella cheese. Served with Spanish rice & ranch dressing. ","","","","","13.99","1191","9256","0","0","0","1","1","0","0","0000-00-00 00:00:00","2015-04-27 01:30:00","0","","Locations^North Dakota^Minot^Paradiso/Minot^Menu^From the Grill","Taxable Goods","1","0","0","0","0","0","","",""
"","1","","The Famous Paradiso Chimi","This is the one everybody talks about! One bite and you’ll agree it’s the best. A giant tortilla stuffed with your choice of meat or seafood filling, crisped until golden brown. Smothered in our special homemade sauce. Served with shredded lettuce, freshly chopped tomatoes, sour cream topping, Spanish rice and your choice of beans. Substitute Spanish rice and beans with our fresh, seasoned and grilled vegetable mix for .99.","","","","","14.49","1192","3727","0","0","0","1","1","0","0","","2015-04-27 01:30:00","0","","Locations^North Dakota^Minot^Paradiso/Minot^Menu^Chimichangas","Taxable Goods","1","0","0","0","0","0","","",""
"","1","","Chimi Fundido","Tender shredded beef or chicken and creamy fundido sauce makes this chimi a great choice. We add a hint of jalapeno, top it off with melted Monterey Jack and Cheddar cheese and serve it with Spanish rice and your choice of beans. Substitute Spanish rice and beans with our fresh, seasoned and grilled vegetable mix for .99.","","","","","14.49","1192","3728","0","0","0","1","1","0","0","","2015-04-27 01:30:00","0","","Locations^North Dakota^Minot^Paradiso/Minot^Menu^Chimichangas","Taxable Goods","1","0","0","0","0","0","","",""
"","1","","Chile Relleno (homestyle)","Monterey Jack cheese and fresh poblano peppers rolled into an egg roll wrapper, crisped until golden and served with red sauce, Spanish rice and fresh, seasoned and grilled vegetable mix.","","","","","8.99","1187","3683","0","0","0","1","1","0","0","0000-00-00 00:00:00","2015-04-27 01:30:00","0","","Locations^North Dakota^Minot^Paradiso/Minot^Menu^Vegetarian","Taxable Goods","1","0","0","0","0","0","","",""
"","1","","Jalapeno or Bean and Cheese Burrito","Your choice of a bean and cheese burrito or a bean and cheese burrito fired up with jalapeno peppers. Topped with mild Cheddar and Monterey Jack cheese and our homemade red sauce.","","","","","9.99","1188","3708","0","0","0","1","1","0","0","0000-00-00 00:00:00","2015-04-27 01:30:00","0","","Locations^North Dakota^Minot^Paradiso/Minot^Menu^Vegetarian","Taxable Goods","1","0","0","0","0","0","","",""
"","1","","Southwest Veggie Quesadilla","A large flour tortilla stuffed with a blend of mild Cheddar and Monterey Jack cheese, a medly of black bean and corn salsa, and pico de gallo.  Grilled until crisp and golden brown, served with fresh avocado and sour cream topping.","","","","","10.99","1190","3711","0","0","0","1","1","0","0","0000-00-00 00:00:00","2015-04-27 01:30:00","0","","Locations^North Dakota^Minot^Paradiso/Minot^Menu^Vegetarian","Taxable Goods","1","0","0","0","0","0","","",""
"","1","","Veggie Burrito","A colorful mix of our fresh, seasoned and grilled vegetable mix, stuffed into a warm tortilla and covered with creamy queso blanco. Offered with Spanish rice and garnished with lettuce and tomatoes. Add meatless chicken or beef for 2.00.","","","","","10.99","1188","9247","0","0","0","1","1","0","0","0000-00-00 00:00:00","2015-04-27 01:30:00","0","","Locations^North Dakota^Minot^Paradiso/Minot^Menu^Vegetarian","Taxable Goods","1","0","0","0","0","0","","",""
"","1","","Veggie Enchiladas","Muy delicioso! Two hand-rolled flour tortillas filled with a colorful blend of our fresh, seasoned and grilled vegetables with shredded mozzarella cheese. Smothered with our creamy queso blanco and served with Spanish rice.  Add meatless chicken or beef for 2.00.","","","","","10.99","1187","9248","0","0","0","1","1","0","0","0000-00-00 00:00:00","2015-04-27 01:30:00","0","","Locations^North Dakota^Minot^Paradiso/Minot^Menu^Vegetarian","Taxable Goods","1","0","0","0","0","0","","",""
"","1","","Veggie Trio Magnifico","Better bring your appetite to this grande platter! We load your plate with three of our most popular vegetarian selections: a hand-rolled veggie burrito, a cheese enchilada, and a chile relleno with fresh poblano peppers, all covered in creamy queso blanco and served with Spanish rice.","","","","","13.99","12672","20614","0","0","0","1","1","0","0","","2016-04-27 22:42:51","0","","Locations^North Dakota^Minot^Paradiso/Minot^Menu^Vegetarian","Taxable Goods","1","0","0","0","0","0","","",""
"","1","","Chips","Bag","","","","","3.5","1193","4528","0","0","0","1","1","0","0","0000-00-00 00:00:00","2015-04-27 01:30:00","0","","Locations^North Dakota^Minot^Paradiso/Minot^Menu^Sides","Taxable Goods","1","0","0","0","0","0","","",""
"","1","","Salsa","Pint","","","","","4","1193","4529","0","0","0","1","1","0","0","","2015-04-27 01:30:00","0","","Locations^North Dakota^Minot^Paradiso/Minot^Menu^Sides","Taxable Goods","1","0","0","0","0","0","","",""
"","1","","Hot Salsa","Pint","","","","","5","1193","4530","0","0","0","1","1","0","0","","2015-04-27 01:30:00","0","","Locations^North Dakota^Minot^Paradiso/Minot^Menu^Sides","Taxable Goods","1","0","0","0","0","0","","",""
"","1","","Queso Blanco","Pint","","","","","10","1193","4531","0","0","0","1","1","0","0","","2015-04-27 01:30:00","0","","Locations^North Dakota^Minot^Paradiso/Minot^Menu^Sides","Taxable Goods","1","0","0","0","0","0","","",""
"","1","","Chili Con Queso","Pint","","","","","10","1193","4532","0","0","0","1","1","0","0","","2015-04-27 01:30:00","0","","Locations^North Dakota^Minot^Paradiso/Minot^Menu^Sides","Taxable Goods","1","0","0","0","0","0","","",""
"","1","","Red Sauce","Pint","","","","","5","1193","4533","0","0","0","1","1","0","0","","2015-04-27 01:30:00","0","","Locations^North Dakota^Minot^Paradiso/Minot^Menu^Sides","Taxable Goods","1","0","0","0","0","0","","",""
"","1","","Green Sauce","Pint","","","","","5","1193","4534","0","0","0","1","1","0","0","","2015-04-27 01:30:00","0","","Locations^North Dakota^Minot^Paradiso/Minot^Menu^Sides","Taxable Goods","1","0","0","0","0","0","","",""
"","1","","Salsa Verde Sauce","Pint","","","","","5","1193","4535","0","0","0","1","1","0","0","","2015-04-27 01:30:00","0","","Locations^North Dakota^Minot^Paradiso/Minot^Menu^Sides","Taxable Goods","1","0","0","0","0","0","","",""
"","1","","Seafood Sauce","Pint","","","","","5","1193","4536","0","0","0","1","1","0","0","","2015-04-27 01:30:00","0","","Locations^North Dakota^Minot^Paradiso/Minot^Menu^Sides","Taxable Goods","1","0","0","0","0","0","","",""
"","1","","Beans","Pint","","","","","5","1193","4537","0","0","0","1","1","0","0","","2015-04-27 01:30:00","0","","Locations^North Dakota^Minot^Paradiso/Minot^Menu^Sides","Taxable Goods","1","0","0","0","0","0","","",""
"","1","","Rice","Pint","","","","","5","1193","4538","0","0","0","1","1","0","0","","2015-04-27 01:30:00","0","","Locations^North Dakota^Minot^Paradiso/Minot^Menu^Sides","Taxable Goods","1","0","0","0","0","0","","",""
"","1","","Guacamole","","","","","","1.99","1193","5437","0","0","0","1","1","0","0","","2015-04-27 01:30:00","0","","Locations^North Dakota^Minot^Paradiso/Minot^Menu^Sides","Taxable Goods","1","0","0","0","0","0","","",""
"","1","","Kids Fiesta Taco Platter","Your choice of a soft or a hard shell beef taco served with Spanish rice and refried beans.","","","","","4.49","13713","26676","0","0","0","1","1","0","0","","2016-08-31 13:08:47","0","","Locations^North Dakota^Minot^Paradiso/Minot^Menu^Kids Menu","Taxable Goods","1","0","0","0","0","0","","",""
"","1","","Kids Fish'n'Fries","A fish fillet, lightly breaded and crisped until golden brown, served with fries.","","","","","4.49","13713","26677","0","0","0","1","1","0","0","","2016-08-31 13:09:39","0","","Locations^North Dakota^Minot^Paradiso/Minot^Menu^Kids Menu","Taxable Goods","1","0","0","0","0","0","","",""
"","1","","Kids Bean & Cheese Burrito","This kiddie-size vegetarian burrito is filled with refried beans and a blend of mild Cheddar and Monterey Jack cheese then topped with red sauce.","","","","","4.49","13713","26678","0","0","0","1","1","0","0","","2016-08-31 13:10:17","0","","Locations^North Dakota^Minot^Paradiso/Minot^Menu^Kids Menu","Taxable Goods","1","0","0","0","0","0","","",""
"","1","","Kids Pronto Puppies","Mini corn dogs served with golden fries.","","","","","4.49","13713","26679","0","0","0","1","1","0","0","","2016-08-31 13:10:41","0","","Locations^North Dakota^Minot^Paradiso/Minot^Menu^Kids Menu","Taxable Goods","1","0","0","0","0","0","","",""
"","1","","Kids Pinata Platter","A beef, chicken or cheese enchilada served with Spanish rice and refried beans.","","","","","4.49","13713","26680","0","0","0","1","1","0","0","","2016-08-31 13:11:06","0","","Locations^North Dakota^Minot^Paradiso/Minot^Menu^Kids Menu","Taxable Goods","1","0","0","0","0","0","","",""
"","1","","Kids Poco Burger","A smaller hamburger served with fries.","","","","","4.49","13713","26681","0","0","0","1","1","0","0","","2016-08-31 13:11:42","0","","Locations^North Dakota^Minot^Paradiso/Minot^Menu^Kids Menu","Taxable Goods","1","0","0","0","0","0","","",""
"","1","","Kids Quesadilla","This yummy quesadilla is stuffed with tomato, bacon and a blend of mild Cheddar and Monterey Jack cheese. An all-time favorite!","","","","","4.49","13713","26682","0","0","0","1","1","0","0","","2016-08-31 13:12:06","0","","Locations^North Dakota^Minot^Paradiso/Minot^Menu^Kids Menu","Taxable Goods","1","0","0","0","0","0","","",""
"","1","","Kids Chicken Tenders","Chicken breast tenders, lightly crisped until golden brown. Served with fries.","","","","","4.49","13713","26683","0","0","0","1","1","0","0","","2016-08-31 13:12:35","0","","Locations^North Dakota^Minot^Paradiso/Minot^Menu^Kids Menu","Taxable Goods","1","0","0","0","0","0","","",""
"","1","","Kids Chicken Flautas","A pair of lightly crisped and hand-rolled chicken flautas served with Spanish rice, refried beans and an optional side of jalapeño jelly sauce for dipping.","","","","","4.99","13713","26684","0","0","5","1","1","0","0","","2016-08-31 13:13:06","0","","Locations^North Dakota^Minot^Paradiso/Minot^Menu^Kids Menu","Taxable Goods","1","0","0","0","0","0","","",""
